{"protocol_version":2,"type":"room_joined","request_id":"join-1","room_revision":8,"payload":{"room_id":"room-1","member_id":"member-1","resume_token":"resume-1","lock_enabled":true,"snapshot":{},"lock_sets":[{"member_id":"member-2","member_name":"proofreader","granted":true,"line_ids":["9K3MT7Q2CD-2"],"conflicts":[],"generation":4}],"presence":{"members":[{"member_id":"member-1","nickname":"translator","line_id":"9K3MT7Q2CD-1","last_seen":"2026-07-16T00:00:00Z"}]}}}
